{
  "pageTitle": "SOUND",
  "pageDescription": "Explorez mes cr√©ations sonores et performances DJ",
  "backgroundImage": "/images/uploads/lxst_child_foggy_red_and_purple_hue_neon_extreme_brutalism_clou_0df11c47-adbd-405c-9bca-f17380d46565.png",
  "tracksTitle": "Tracks",
  "djSetsTitle": "DJ Sets",
  "collaborationsTitle": "Collaborations"
}